2025-11-13 15:51:23,858 - INFO - Next run scheduled at 2025-11-13 15:52:00. Sleeping for 36.141762 seconds.
2025-11-13 15:52:00,006 - INFO - Starting execution of master workflow...
2025-11-13 15:52:00,009 - INFO - Executing step1_db_to_csv...
2025-11-13 15:52:00,018 - INFO - rawData start:2025_11_10, end:2025_11_13
2025-11-13 15:52:05,362 - INFO - Exported CSV to data_merged/merged_messages.csv | sites=['233-255 Botany Road, Waterloo'] | start=2025-11-10T00:00:00 | end=2025-11-14T00:00:00
2025-11-13 15:52:05,363 - INFO - files have been merged to data_merged/merged_messages.csv
2025-11-13 15:52:05,364 - INFO - Executing step2_get_processed_data...
2025-11-13 15:52:05,419 - INFO - Deleted rows where meter_serial is NULL
2025-11-13 15:52:05,419 - INFO - remain 11334 rows
2025-11-13 15:52:05,420 - INFO - Deleting duplicate data for the same water meter with a time interval less than 14 minutes, and only retaining the first one
2025-11-13 15:52:08,294 - INFO - Deleted duplicate rows with a time difference less than 14 minutes (only the first one was kept), 1155 rows deleted
2025-11-13 15:52:08,294 - INFO - remain 10179 rows
2025-11-13 15:52:08,295 - INFO - Updating timestamp to the nearest 15 minutes
2025-11-13 15:52:08,314 - INFO - Updated all timestamps to the latest 15 minutes
2025-11-13 15:52:08,315 - INFO - Deleting abnormal readings under the same water meter
2025-11-13 15:52:08,878 - INFO - Deleted rows with abnormal reading, a total of 0 rows deleted
2025-11-13 15:52:08,878 - INFO - remain 10179 rows
2025-11-13 15:52:08,928 - INFO - The data is processed and saved to data_merged/processed_messages.csv
2025-11-13 15:52:08,929 - INFO - Executing step3_get_NMI12_ori...
2025-11-13 15:52:08,929 - INFO - NMI12 startTime:2025-11-11 00:00:00, endTime:2025-11-13 23:59:59
2025-11-13 15:52:10,065 - INFO - Saved the file data_merged/NMI12/NEM12#2025111100001#X4MDP#Evergy.csv
2025-11-13 15:52:10,087 - INFO - Saved the file data_merged/NMI12/NEM12#2025111200002#X4MDP#Evergy.csv
2025-11-13 15:52:10,087 - INFO - Generated!
2025-11-13 15:52:10,087 - INFO - Executing step4_get_all300_andTiggerDate...
2025-11-13 15:52:10,089 - INFO - Sorted data saved to data_merged/output_meter_data_sorted.csv
2025-11-13 15:52:10,089 - INFO - Backtracked data saved to data_merged/output_meter_data_backtracked_sorted.csv
2025-11-13 15:52:10,089 - INFO - Executing step5_multiple300_clear610...
2025-11-13 15:52:10,091 - INFO - Modified file NEM12#2025111100001#X4MDP#Evergy.csv
2025-11-13 15:52:10,091 - INFO - Modified file NEM12#2025111200002#X4MDP#Evergy.csv
2025-11-13 15:52:10,091 - INFO - Executing step6_clear610and710...
2025-11-13 15:52:10,091 - INFO - file: NEM12#2025111100001#X4MDP#Evergy.csv
2025-11-13 15:52:10,091 - INFO - dict: {}
2025-11-13 15:52:10,091 - INFO - nums of meters: 0

2025-11-13 15:52:10,091 - INFO - file: NEM12#2025111200002#X4MDP#Evergy.csv
2025-11-13 15:52:10,091 - INFO - dict: {}
2025-11-13 15:52:10,091 - INFO - nums of meters: 0

2025-11-13 15:52:10,093 - INFO - Step 6 is completed, the results have been saved to data_merged/meter_dict.csv and data_merged/modification_records.csv
2025-11-13 15:52:10,093 - INFO - Executing step7_SendEmail...
2025-11-13 15:52:11,145 - INFO - Email sent to ['winston@jdktech.com.au', 'winston.hu2143@hotmail.com'] with NEM12#2025111200002#X4MDP#Evergy.csv
2025-11-13 15:52:11,145 - INFO - Master workflow execution completed.
2025-11-13 15:52:11,171 - INFO - Next run scheduled at 2025-11-14 15:52:00. Sleeping for 86388.828976 seconds.
2025-11-13 15:52:27,621 - INFO - Terminating the workflow gracefully...
2025-11-14 10:52:45,733 - INFO - Next run scheduled at 2025-11-14 10:53:00. Sleeping for 14.266961 seconds.
2025-11-14 10:53:00,007 - INFO - Starting execution of master workflow...
2025-11-14 10:53:00,010 - INFO - Executing step1_db_to_csv...
2025-11-14 10:53:00,011 - INFO - rawData start:2025_11_11, end:2025_11_14
2025-11-14 10:53:05,394 - INFO - Exported CSV to data_merged/merged_messages.csv | sites=['233-255 Botany Road, Waterloo'] | start=2025-11-11T00:00:00 | end=2025-11-15T00:00:00
2025-11-14 10:53:05,395 - INFO - files have been merged to data_merged/merged_messages.csv
2025-11-14 10:53:05,395 - INFO - Executing step2_get_processed_data...
2025-11-14 10:53:05,441 - INFO - Deleted rows where meter_serial is NULL
2025-11-14 10:53:05,441 - INFO - remain 10625 rows
2025-11-14 10:53:05,442 - INFO - Deleting duplicate data for the same water meter with a time interval less than 14 minutes, and only retaining the first one
2025-11-14 10:53:08,121 - INFO - Deleted duplicate rows with a time difference less than 14 minutes (only the first one was kept), 1026 rows deleted
2025-11-14 10:53:08,121 - INFO - remain 9599 rows
2025-11-14 10:53:08,122 - INFO - Updating timestamp to the nearest 15 minutes
2025-11-14 10:53:08,141 - INFO - Updated all timestamps to the latest 15 minutes
2025-11-14 10:53:08,141 - INFO - Deleting abnormal readings under the same water meter
2025-11-14 10:53:08,667 - INFO - Deleted rows with abnormal reading, a total of 0 rows deleted
2025-11-14 10:53:08,667 - INFO - remain 9599 rows
2025-11-14 10:53:08,713 - INFO - The data is processed and saved to data_merged/processed_messages.csv
2025-11-14 10:53:08,713 - INFO - Executing step3_get_NMI12_ori...
2025-11-14 10:53:08,713 - INFO - NMI12 startTime:2025-11-12 00:00:00, endTime:2025-11-14 23:59:59
2025-11-14 10:53:09,769 - INFO - Saved the file data_merged/NMI12/NEM12#2025111200001#X4MDP#Evergy.csv
2025-11-14 10:53:09,792 - INFO - Saved the file data_merged/NMI12/NEM12#2025111300002#X4MDP#Evergy.csv
2025-11-14 10:53:09,793 - INFO - Generated!
2025-11-14 10:53:09,793 - INFO - Executing step4_get_all300_andTiggerDate...
2025-11-14 10:53:09,796 - INFO - Sorted data saved to data_merged/output_meter_data_sorted.csv
2025-11-14 10:53:09,797 - INFO - Backtracked data saved to data_merged/output_meter_data_backtracked_sorted.csv
2025-11-14 10:53:09,797 - INFO - Executing step5_multiple300_clear610...
2025-11-14 10:53:09,800 - INFO - Modified file NEM12#2025111200001#X4MDP#Evergy.csv
2025-11-14 10:53:09,800 - INFO - Modified file NEM12#2025111300002#X4MDP#Evergy.csv
2025-11-14 10:53:09,800 - INFO - Modified file NEM12#2025111100001#X4MDP#Evergy.csv
2025-11-14 10:53:09,801 - INFO - Modified file NEM12#2025111200002#X4MDP#Evergy.csv
2025-11-14 10:53:09,801 - INFO - Executing step6_clear610and710...
2025-11-14 10:53:09,801 - INFO - file: NEM12#2025111100001#X4MDP#Evergy.csv
2025-11-14 10:53:09,801 - INFO - dict: {}
2025-11-14 10:53:09,801 - INFO - nums of meters: 0

2025-11-14 10:53:09,801 - INFO - file: NEM12#2025111200001#X4MDP#Evergy.csv
2025-11-14 10:53:09,801 - INFO - dict: {}
2025-11-14 10:53:09,801 - INFO - nums of meters: 0

2025-11-14 10:53:09,801 - INFO - file: NEM12#2025111200002#X4MDP#Evergy.csv
2025-11-14 10:53:09,801 - INFO - dict: {}
2025-11-14 10:53:09,801 - INFO - nums of meters: 0

2025-11-14 10:53:09,802 - INFO - file: NEM12#2025111300002#X4MDP#Evergy.csv
2025-11-14 10:53:09,802 - INFO - dict: {}
2025-11-14 10:53:09,802 - INFO - nums of meters: 0

2025-11-14 10:53:09,802 - INFO - Step 6 is completed, the results have been saved to data_merged/meter_dict.csv and data_merged/modification_records.csv
2025-11-14 10:53:09,802 - INFO - Executing step7_SendEmail...
2025-11-14 10:53:09,803 - INFO - Start scanning the directory: /Users/jdk/github_repos/meter-reading-system-AllinOne/apps/backend/NEM12_generater/data_merged/NMI12_modified

2025-11-14 10:53:09,803 - ERROR - Error in step7_SendEmail: [Errno 2] No such file or directory: '../data_merged/NMI12_modified'
2025-11-14 10:53:09,803 - INFO - Master workflow execution completed.
2025-11-14 10:53:09,815 - INFO - Next run scheduled at 2025-11-15 10:53:00. Sleeping for 86390.184327 seconds.
2025-11-14 10:53:55,727 - INFO - Terminating the workflow gracefully...
2025-11-14 10:55:52,272 - INFO - Next run scheduled at 2025-11-14 10:56:00. Sleeping for 7.728006 seconds.
2025-11-14 10:56:00,005 - INFO - Starting execution of master workflow...
2025-11-14 10:56:00,006 - INFO - Executing step1_db_to_csv...
2025-11-14 10:56:00,007 - INFO - rawData start:2025_11_11, end:2025_11_14
2025-11-14 10:56:05,294 - INFO - Exported CSV to data_merged/merged_messages.csv | sites=['233-255 Botany Road, Waterloo'] | start=2025-11-11T00:00:00 | end=2025-11-15T00:00:00
2025-11-14 10:56:05,295 - INFO - files have been merged to data_merged/merged_messages.csv
2025-11-14 10:56:05,295 - INFO - Executing step2_get_processed_data...
2025-11-14 10:56:05,346 - INFO - Deleted rows where meter_serial is NULL
2025-11-14 10:56:05,346 - INFO - remain 10625 rows
2025-11-14 10:56:05,347 - INFO - Deleting duplicate data for the same water meter with a time interval less than 14 minutes, and only retaining the first one
2025-11-14 10:56:08,014 - INFO - Deleted duplicate rows with a time difference less than 14 minutes (only the first one was kept), 1026 rows deleted
2025-11-14 10:56:08,015 - INFO - remain 9599 rows
2025-11-14 10:56:08,015 - INFO - Updating timestamp to the nearest 15 minutes
2025-11-14 10:56:08,033 - INFO - Updated all timestamps to the latest 15 minutes
2025-11-14 10:56:08,033 - INFO - Deleting abnormal readings under the same water meter
2025-11-14 10:56:08,562 - INFO - Deleted rows with abnormal reading, a total of 0 rows deleted
2025-11-14 10:56:08,562 - INFO - remain 9599 rows
2025-11-14 10:56:08,609 - INFO - The data is processed and saved to data_merged/processed_messages.csv
2025-11-14 10:56:08,609 - INFO - Executing step3_get_NMI12_ori...
2025-11-14 10:56:08,609 - INFO - NMI12 startTime:2025-11-12 00:00:00, endTime:2025-11-14 23:59:59
2025-11-14 10:56:09,661 - INFO - Saved the file data_merged/NMI12/NEM12#2025111200001#X4MDP#Evergy.csv
2025-11-14 10:56:09,684 - INFO - Saved the file data_merged/NMI12/NEM12#2025111300002#X4MDP#Evergy.csv
2025-11-14 10:56:09,684 - INFO - Generated!
2025-11-14 10:56:09,684 - INFO - Executing step4_get_all300_andTiggerDate...
2025-11-14 10:56:09,687 - INFO - Sorted data saved to data_merged/output_meter_data_sorted.csv
2025-11-14 10:56:09,688 - INFO - Backtracked data saved to data_merged/output_meter_data_backtracked_sorted.csv
2025-11-14 10:56:09,688 - INFO - Executing step5_multiple300_clear610...
2025-11-14 10:56:09,690 - INFO - Modified file NEM12#2025111200001#X4MDP#Evergy.csv
2025-11-14 10:56:09,691 - INFO - Modified file NEM12#2025111300002#X4MDP#Evergy.csv
2025-11-14 10:56:09,691 - INFO - Modified file NEM12#2025111100001#X4MDP#Evergy.csv
2025-11-14 10:56:09,691 - INFO - Modified file NEM12#2025111200002#X4MDP#Evergy.csv
2025-11-14 10:56:09,691 - INFO - Executing step6_clear610and710...
2025-11-14 10:56:09,692 - INFO - file: NEM12#2025111100001#X4MDP#Evergy.csv
2025-11-14 10:56:09,692 - INFO - dict: {}
2025-11-14 10:56:09,692 - INFO - nums of meters: 0

2025-11-14 10:56:09,692 - INFO - file: NEM12#2025111200001#X4MDP#Evergy.csv
2025-11-14 10:56:09,692 - INFO - dict: {}
2025-11-14 10:56:09,692 - INFO - nums of meters: 0

2025-11-14 10:56:09,692 - INFO - file: NEM12#2025111200002#X4MDP#Evergy.csv
2025-11-14 10:56:09,692 - INFO - dict: {}
2025-11-14 10:56:09,692 - INFO - nums of meters: 0

2025-11-14 10:56:09,692 - INFO - file: NEM12#2025111300002#X4MDP#Evergy.csv
2025-11-14 10:56:09,692 - INFO - dict: {}
2025-11-14 10:56:09,692 - INFO - nums of meters: 0

2025-11-14 10:56:09,693 - INFO - Step 6 is completed, the results have been saved to data_merged/meter_dict.csv and data_merged/modification_records.csv
2025-11-14 10:56:09,693 - INFO - Executing step7_SendEmail...
2025-11-14 10:56:09,693 - INFO - Start scanning the directory: /Users/jdk/github_repos/meter-reading-system-AllinOne/apps/backend/NEM12_generater/data_merged/NMI12_modified

2025-11-14 10:56:09,693 - ERROR - Error in step7_SendEmail: [Errno 2] No such file or directory: '../data_merged/NMI12_modified'
2025-11-14 10:56:09,693 - INFO - Master workflow execution completed.
2025-11-14 10:56:09,703 - INFO - Next run scheduled at 2025-11-15 10:56:00. Sleeping for 86390.297021 seconds.
2025-11-14 10:56:29,565 - INFO - Terminating the workflow gracefully...
2025-11-14 10:59:00,465 - INFO - Next run scheduled at 2025-11-15 10:59:00. Sleeping for 86399.534256 seconds.
2025-11-14 10:59:03,397 - INFO - Terminating the workflow gracefully...
2025-11-14 10:59:10,174 - INFO - Next run scheduled at 2025-11-14 11:00:00. Sleeping for 49.825401 seconds.
2025-11-14 11:00:00,005 - INFO - Starting execution of master workflow...
2025-11-14 11:00:00,009 - INFO - Executing step1_db_to_csv...
2025-11-14 11:00:00,011 - INFO - rawData start:2025_11_11, end:2025_11_14
2025-11-14 11:00:05,448 - INFO - Exported CSV to data_merged/merged_messages.csv | sites=['233-255 Botany Road, Waterloo'] | start=2025-11-11T00:00:00 | end=2025-11-15T00:00:00
2025-11-14 11:00:05,449 - INFO - files have been merged to data_merged/merged_messages.csv
2025-11-14 11:00:05,450 - INFO - Executing step2_get_processed_data...
2025-11-14 11:00:05,498 - INFO - Deleted rows where meter_serial is NULL
2025-11-14 11:00:05,498 - INFO - remain 10670 rows
2025-11-14 11:00:05,499 - INFO - Deleting duplicate data for the same water meter with a time interval less than 14 minutes, and only retaining the first one
2025-11-14 11:00:08,197 - INFO - Deleted duplicate rows with a time difference less than 14 minutes (only the first one was kept), 1042 rows deleted
2025-11-14 11:00:08,197 - INFO - remain 9628 rows
2025-11-14 11:00:08,198 - INFO - Updating timestamp to the nearest 15 minutes
2025-11-14 11:00:08,217 - INFO - Updated all timestamps to the latest 15 minutes
2025-11-14 11:00:08,217 - INFO - Deleting abnormal readings under the same water meter
2025-11-14 11:00:08,738 - INFO - Deleted rows with abnormal reading, a total of 0 rows deleted
2025-11-14 11:00:08,738 - INFO - remain 9628 rows
2025-11-14 11:00:08,785 - INFO - The data is processed and saved to data_merged/processed_messages.csv
2025-11-14 11:00:08,785 - INFO - Executing step3_get_NMI12_ori...
2025-11-14 11:00:08,785 - INFO - NMI12 startTime:2025-11-12 00:00:00, endTime:2025-11-14 23:59:59
2025-11-14 11:00:09,841 - INFO - Saved the file data_merged/NMI12/NEM12#2025111200001#X4MDP#Evergy.csv
2025-11-14 11:00:09,865 - INFO - Saved the file data_merged/NMI12/NEM12#2025111300002#X4MDP#Evergy.csv
2025-11-14 11:00:09,865 - INFO - Generated!
2025-11-14 11:00:09,865 - INFO - Executing step4_get_all300_andTiggerDate...
2025-11-14 11:00:09,868 - INFO - Sorted data saved to data_merged/output_meter_data_sorted.csv
2025-11-14 11:00:09,869 - INFO - Backtracked data saved to data_merged/output_meter_data_backtracked_sorted.csv
2025-11-14 11:00:09,869 - INFO - Executing step5_multiple300_clear610...
2025-11-14 11:00:09,873 - INFO - Modified file NEM12#2025111200001#X4MDP#Evergy.csv
2025-11-14 11:00:09,873 - INFO - Modified file NEM12#2025111300002#X4MDP#Evergy.csv
2025-11-14 11:00:09,874 - INFO - Modified file NEM12#2025111100001#X4MDP#Evergy.csv
2025-11-14 11:00:09,875 - INFO - Modified file NEM12#2025111200002#X4MDP#Evergy.csv
2025-11-14 11:00:09,875 - INFO - Executing step6_clear610and710...
2025-11-14 11:00:09,875 - INFO - file: NEM12#2025111100001#X4MDP#Evergy.csv
2025-11-14 11:00:09,875 - INFO - dict: {}
2025-11-14 11:00:09,875 - INFO - nums of meters: 0

2025-11-14 11:00:09,875 - INFO - file: NEM12#2025111200001#X4MDP#Evergy.csv
2025-11-14 11:00:09,875 - INFO - dict: {}
2025-11-14 11:00:09,875 - INFO - nums of meters: 0

2025-11-14 11:00:09,875 - INFO - file: NEM12#2025111200002#X4MDP#Evergy.csv
2025-11-14 11:00:09,875 - INFO - dict: {}
2025-11-14 11:00:09,875 - INFO - nums of meters: 0

2025-11-14 11:00:09,875 - INFO - file: NEM12#2025111300002#X4MDP#Evergy.csv
2025-11-14 11:00:09,875 - INFO - dict: {}
2025-11-14 11:00:09,875 - INFO - nums of meters: 0

2025-11-14 11:00:09,876 - INFO - Step 6 is completed, the results have been saved to data_merged/meter_dict.csv and data_merged/modification_records.csv
2025-11-14 11:00:09,876 - INFO - Executing step7_SendEmail...
2025-11-14 11:00:09,876 - INFO - Start scanning the directory: /Users/jdk/github_repos/meter-reading-system-AllinOne/apps/backend/NEM12_generater/data_merged/NMI12_modified

2025-11-14 11:00:09,876 - ERROR - Error in step7_SendEmail: [Errno 2] No such file or directory: '../data_merged/NMI12_modified'
2025-11-14 11:00:09,876 - INFO - Master workflow execution completed.
2025-11-14 11:00:09,886 - INFO - Next run scheduled at 2025-11-15 11:00:00. Sleeping for 86390.113836 seconds.
2025-11-14 11:00:48,764 - INFO - Terminating the workflow gracefully...
2025-11-14 11:01:58,707 - INFO - Next run scheduled at 2025-11-14 11:02:00. Sleeping for 1.29292 seconds.
2025-11-14 11:02:00,005 - INFO - Starting execution of master workflow...
2025-11-14 11:02:00,005 - INFO - Executing step1_db_to_csv...
2025-11-14 11:02:00,006 - INFO - rawData start:2025_11_11, end:2025_11_14
2025-11-14 11:02:06,029 - INFO - Exported CSV to data_merged/merged_messages.csv | sites=['233-255 Botany Road, Waterloo'] | start=2025-11-11T00:00:00 | end=2025-11-15T00:00:00
2025-11-14 11:02:06,030 - INFO - files have been merged to data_merged/merged_messages.csv
2025-11-14 11:02:06,031 - INFO - Executing step2_get_processed_data...
2025-11-14 11:02:06,080 - INFO - Deleted rows where meter_serial is NULL
2025-11-14 11:02:06,080 - INFO - remain 10670 rows
2025-11-14 11:02:06,080 - INFO - Deleting duplicate data for the same water meter with a time interval less than 14 minutes, and only retaining the first one
2025-11-14 11:02:08,791 - INFO - Deleted duplicate rows with a time difference less than 14 minutes (only the first one was kept), 1042 rows deleted
2025-11-14 11:02:08,791 - INFO - remain 9628 rows
2025-11-14 11:02:08,792 - INFO - Updating timestamp to the nearest 15 minutes
2025-11-14 11:02:08,811 - INFO - Updated all timestamps to the latest 15 minutes
2025-11-14 11:02:08,811 - INFO - Deleting abnormal readings under the same water meter
2025-11-14 11:02:09,357 - INFO - Deleted rows with abnormal reading, a total of 0 rows deleted
2025-11-14 11:02:09,357 - INFO - remain 9628 rows
2025-11-14 11:02:09,403 - INFO - The data is processed and saved to data_merged/processed_messages.csv
2025-11-14 11:02:09,403 - INFO - Executing step3_get_NMI12_ori...
2025-11-14 11:02:09,403 - INFO - NMI12 startTime:2025-11-12 00:00:00, endTime:2025-11-14 23:59:59
2025-11-14 11:02:10,468 - INFO - Saved the file data_merged/NMI12/NEM12#2025111200001#X4MDP#Evergy.csv
2025-11-14 11:02:10,491 - INFO - Saved the file data_merged/NMI12/NEM12#2025111300002#X4MDP#Evergy.csv
2025-11-14 11:02:10,492 - INFO - Generated!
2025-11-14 11:02:10,492 - INFO - Executing step4_get_all300_andTiggerDate...
2025-11-14 11:02:10,494 - INFO - Sorted data saved to data_merged/output_meter_data_sorted.csv
2025-11-14 11:02:10,495 - INFO - Backtracked data saved to data_merged/output_meter_data_backtracked_sorted.csv
2025-11-14 11:02:10,495 - INFO - Executing step5_multiple300_clear610...
2025-11-14 11:02:10,497 - INFO - Modified file NEM12#2025111200001#X4MDP#Evergy.csv
2025-11-14 11:02:10,497 - INFO - Modified file NEM12#2025111300002#X4MDP#Evergy.csv
2025-11-14 11:02:10,498 - INFO - Modified file NEM12#2025111100001#X4MDP#Evergy.csv
2025-11-14 11:02:10,498 - INFO - Modified file NEM12#2025111200002#X4MDP#Evergy.csv
2025-11-14 11:02:10,498 - INFO - Executing step6_clear610and710...
2025-11-14 11:02:10,498 - INFO - file: NEM12#2025111100001#X4MDP#Evergy.csv
2025-11-14 11:02:10,498 - INFO - dict: {}
2025-11-14 11:02:10,498 - INFO - nums of meters: 0

2025-11-14 11:02:10,498 - INFO - file: NEM12#2025111200001#X4MDP#Evergy.csv
2025-11-14 11:02:10,498 - INFO - dict: {}
2025-11-14 11:02:10,498 - INFO - nums of meters: 0

2025-11-14 11:02:10,498 - INFO - file: NEM12#2025111200002#X4MDP#Evergy.csv
2025-11-14 11:02:10,498 - INFO - dict: {}
2025-11-14 11:02:10,498 - INFO - nums of meters: 0

2025-11-14 11:02:10,499 - INFO - file: NEM12#2025111300002#X4MDP#Evergy.csv
2025-11-14 11:02:10,499 - INFO - dict: {}
2025-11-14 11:02:10,499 - INFO - nums of meters: 0

2025-11-14 11:02:10,500 - INFO - Step 6 is completed, the results have been saved to data_merged/meter_dict.csv and data_merged/modification_records.csv
2025-11-14 11:02:10,500 - INFO - Executing step7_SendEmail...
2025-11-14 11:02:10,500 - INFO - Start scanning the directory: /Users/jdk/github_repos/meter-reading-system-AllinOne/apps/backend/NEM12_generater/data_merged/NMI12_modified

2025-11-14 11:02:10,500 - ERROR - Error in step7_SendEmail: [Errno 2] No such file or directory: '../data_merged/NMI12_modified'
2025-11-14 11:02:10,500 - INFO - Master workflow execution completed.
2025-11-14 11:02:10,509 - INFO - Next run scheduled at 2025-11-15 11:02:00. Sleeping for 86389.490513 seconds.
2025-11-14 11:02:16,906 - INFO - Terminating the workflow gracefully...
2025-11-14 11:02:47,352 - INFO - Next run scheduled at 2025-11-14 11:03:00. Sleeping for 12.647528 seconds.
2025-11-14 11:03:00,005 - INFO - Starting execution of master workflow...
2025-11-14 11:03:00,010 - INFO - Executing step1_db_to_csv...
2025-11-14 11:03:00,010 - INFO - rawData start:2025_11_11, end:2025_11_14
2025-11-14 11:03:05,287 - INFO - Exported CSV to data_merged/merged_messages.csv | sites=['233-255 Botany Road, Waterloo'] | start=2025-11-11T00:00:00 | end=2025-11-15T00:00:00
2025-11-14 11:03:05,288 - INFO - files have been merged to data_merged/merged_messages.csv
2025-11-14 11:03:05,288 - INFO - Executing step2_get_processed_data...
2025-11-14 11:03:05,349 - INFO - Deleted rows where meter_serial is NULL
2025-11-14 11:03:05,349 - INFO - remain 10670 rows
2025-11-14 11:03:05,350 - INFO - Deleting duplicate data for the same water meter with a time interval less than 14 minutes, and only retaining the first one
2025-11-14 11:03:08,054 - INFO - Deleted duplicate rows with a time difference less than 14 minutes (only the first one was kept), 1042 rows deleted
2025-11-14 11:03:08,054 - INFO - remain 9628 rows
2025-11-14 11:03:08,055 - INFO - Updating timestamp to the nearest 15 minutes
2025-11-14 11:03:08,074 - INFO - Updated all timestamps to the latest 15 minutes
2025-11-14 11:03:08,074 - INFO - Deleting abnormal readings under the same water meter
2025-11-14 11:03:08,609 - INFO - Deleted rows with abnormal reading, a total of 0 rows deleted
2025-11-14 11:03:08,609 - INFO - remain 9628 rows
2025-11-14 11:03:08,655 - INFO - The data is processed and saved to data_merged/processed_messages.csv
2025-11-14 11:03:08,655 - INFO - Executing step3_get_NMI12_ori...
2025-11-14 11:03:08,655 - INFO - NMI12 startTime:2025-11-12 00:00:00, endTime:2025-11-14 23:59:59
2025-11-14 11:03:09,714 - INFO - Saved the file data_merged/NMI12/NEM12#2025111200001#X4MDP#Evergy.csv
2025-11-14 11:03:09,738 - INFO - Saved the file data_merged/NMI12/NEM12#2025111300002#X4MDP#Evergy.csv
2025-11-14 11:03:09,738 - INFO - Generated!
2025-11-14 11:03:09,738 - INFO - Executing step4_get_all300_andTiggerDate...
2025-11-14 11:03:09,741 - INFO - Sorted data saved to data_merged/output_meter_data_sorted.csv
2025-11-14 11:03:09,741 - INFO - Backtracked data saved to data_merged/output_meter_data_backtracked_sorted.csv
2025-11-14 11:03:09,741 - INFO - Executing step5_multiple300_clear610...
2025-11-14 11:03:09,744 - INFO - Modified file NEM12#2025111200001#X4MDP#Evergy.csv
2025-11-14 11:03:09,746 - INFO - Modified file NEM12#2025111300002#X4MDP#Evergy.csv
2025-11-14 11:03:09,747 - INFO - Modified file NEM12#2025111100001#X4MDP#Evergy.csv
2025-11-14 11:03:09,747 - INFO - Modified file NEM12#2025111200002#X4MDP#Evergy.csv
2025-11-14 11:03:09,747 - INFO - Executing step6_clear610and710...
2025-11-14 11:03:09,747 - INFO - file: NEM12#2025111100001#X4MDP#Evergy.csv
2025-11-14 11:03:09,747 - INFO - dict: {}
2025-11-14 11:03:09,747 - INFO - nums of meters: 0

2025-11-14 11:03:09,747 - INFO - file: NEM12#2025111200001#X4MDP#Evergy.csv
2025-11-14 11:03:09,747 - INFO - dict: {}
2025-11-14 11:03:09,747 - INFO - nums of meters: 0

2025-11-14 11:03:09,747 - INFO - file: NEM12#2025111200002#X4MDP#Evergy.csv
2025-11-14 11:03:09,747 - INFO - dict: {}
2025-11-14 11:03:09,747 - INFO - nums of meters: 0

2025-11-14 11:03:09,747 - INFO - file: NEM12#2025111300002#X4MDP#Evergy.csv
2025-11-14 11:03:09,747 - INFO - dict: {}
2025-11-14 11:03:09,747 - INFO - nums of meters: 0

2025-11-14 11:03:09,748 - INFO - Step 6 is completed, the results have been saved to data_merged/meter_dict.csv and data_merged/modification_records.csv
2025-11-14 11:03:09,748 - INFO - Executing step7_SendEmail...
2025-11-14 11:03:09,748 - INFO - Start scanning the directory: /Users/jdk/github_repos/meter-reading-system-AllinOne/apps/backend/NEM12_generater/data_merged/NMI12_modified

2025-11-14 11:03:09,749 - ERROR - Error in step7_SendEmail: [Errno 2] No such file or directory: '../data_merged/NMI12_modified'
2025-11-14 11:03:09,749 - INFO - Master workflow execution completed.
2025-11-14 11:03:09,758 - INFO - Next run scheduled at 2025-11-15 11:03:00. Sleeping for 86390.241744 seconds.
2025-11-14 11:03:36,098 - INFO - Terminating the workflow gracefully...
2025-11-14 11:04:45,536 - INFO - Next run scheduled at 2025-11-14 11:05:00. Sleeping for 14.463517 seconds.
2025-11-14 11:05:00,005 - INFO - Starting execution of master workflow...
2025-11-14 11:05:00,006 - INFO - Executing step1_db_to_csv...
2025-11-14 11:05:00,006 - INFO - rawData start:2025_11_11, end:2025_11_14
2025-11-14 11:05:05,087 - INFO - Exported CSV to data_merged/merged_messages.csv | sites=['233-255 Botany Road, Waterloo'] | start=2025-11-11T00:00:00 | end=2025-11-15T00:00:00
2025-11-14 11:05:05,089 - INFO - files have been merged to data_merged/merged_messages.csv
2025-11-14 11:05:05,089 - INFO - Executing step2_get_processed_data...
2025-11-14 11:05:05,143 - INFO - Deleted rows where meter_serial is NULL
2025-11-14 11:05:05,143 - INFO - remain 10670 rows
2025-11-14 11:05:05,143 - INFO - Deleting duplicate data for the same water meter with a time interval less than 14 minutes, and only retaining the first one
2025-11-14 11:05:07,909 - INFO - Deleted duplicate rows with a time difference less than 14 minutes (only the first one was kept), 1042 rows deleted
2025-11-14 11:05:07,910 - INFO - remain 9628 rows
2025-11-14 11:05:07,910 - INFO - Updating timestamp to the nearest 15 minutes
2025-11-14 11:05:07,935 - INFO - Updated all timestamps to the latest 15 minutes
2025-11-14 11:05:07,935 - INFO - Deleting abnormal readings under the same water meter
2025-11-14 11:05:08,570 - INFO - Deleted rows with abnormal reading, a total of 0 rows deleted
2025-11-14 11:05:08,570 - INFO - remain 9628 rows
2025-11-14 11:05:08,621 - INFO - The data is processed and saved to data_merged/processed_messages.csv
2025-11-14 11:05:08,621 - INFO - Executing step3_get_NMI12_ori...
2025-11-14 11:05:08,621 - INFO - NMI12 startTime:2025-11-12 00:00:00, endTime:2025-11-14 23:59:59
2025-11-14 11:05:09,904 - INFO - Saved the file data_merged/NMI12/NEM12#2025111200001#X4MDP#Evergy.csv
2025-11-14 11:05:09,928 - INFO - Saved the file data_merged/NMI12/NEM12#2025111300002#X4MDP#Evergy.csv
2025-11-14 11:05:09,928 - INFO - Generated!
2025-11-14 11:05:09,928 - INFO - Executing step4_get_all300_andTiggerDate...
2025-11-14 11:05:09,932 - INFO - Sorted data saved to data_merged/output_meter_data_sorted.csv
2025-11-14 11:05:09,932 - INFO - Backtracked data saved to data_merged/output_meter_data_backtracked_sorted.csv
2025-11-14 11:05:09,932 - INFO - Executing step5_multiple300_clear610...
2025-11-14 11:05:09,934 - INFO - Modified file NEM12#2025111200001#X4MDP#Evergy.csv
2025-11-14 11:05:09,935 - INFO - Modified file NEM12#2025111300002#X4MDP#Evergy.csv
2025-11-14 11:05:09,935 - INFO - Modified file NEM12#2025111100001#X4MDP#Evergy.csv
2025-11-14 11:05:09,935 - INFO - Modified file NEM12#2025111200002#X4MDP#Evergy.csv
2025-11-14 11:05:09,935 - INFO - Executing step6_clear610and710...
2025-11-14 11:05:09,935 - INFO - file: NEM12#2025111100001#X4MDP#Evergy.csv
2025-11-14 11:05:09,935 - INFO - dict: {}
2025-11-14 11:05:09,935 - INFO - nums of meters: 0

2025-11-14 11:05:09,935 - INFO - file: NEM12#2025111200001#X4MDP#Evergy.csv
2025-11-14 11:05:09,935 - INFO - dict: {}
2025-11-14 11:05:09,935 - INFO - nums of meters: 0

2025-11-14 11:05:09,935 - INFO - file: NEM12#2025111200002#X4MDP#Evergy.csv
2025-11-14 11:05:09,935 - INFO - dict: {}
2025-11-14 11:05:09,935 - INFO - nums of meters: 0

2025-11-14 11:05:09,936 - INFO - file: NEM12#2025111300002#X4MDP#Evergy.csv
2025-11-14 11:05:09,936 - INFO - dict: {}
2025-11-14 11:05:09,936 - INFO - nums of meters: 0

2025-11-14 11:05:09,936 - INFO - Step 6 is completed, the results have been saved to data_merged/meter_dict.csv and data_merged/modification_records.csv
2025-11-14 11:05:09,936 - INFO - Executing step7_SendEmail...
2025-11-14 11:05:09,937 - INFO - Start scanning the directory: /Users/jdk/github_repos/meter-reading-system-AllinOne/apps/backend/NEM12_generater/data_merged/NMI12_modified

2025-11-14 11:05:09,937 - ERROR - Error in step7_SendEmail: [Errno 2] No such file or directory: '../data_merged/NMI12_modified'
2025-11-14 11:05:09,937 - INFO - Master workflow execution completed.
2025-11-14 11:05:09,955 - INFO - Next run scheduled at 2025-11-15 11:05:00. Sleeping for 86390.044528 seconds.
2025-11-14 11:05:14,703 - INFO - Terminating the workflow gracefully...
2025-11-14 11:05:36,554 - INFO - Next run scheduled at 2025-11-14 11:15:00. Sleeping for 563.445986 seconds.
2025-11-14 11:05:40,582 - INFO - Terminating the workflow gracefully...
2025-11-14 11:05:45,076 - INFO - Next run scheduled at 2025-11-14 11:06:00. Sleeping for 14.923683 seconds.
2025-11-14 11:06:00,018 - INFO - Starting execution of master workflow...
2025-11-14 11:06:00,018 - INFO - Executing step1_db_to_csv...
2025-11-14 11:06:00,018 - INFO - rawData start:2025_11_11, end:2025_11_14
2025-11-14 11:06:05,445 - INFO - Exported CSV to data_merged/merged_messages.csv | sites=['233-255 Botany Road, Waterloo'] | start=2025-11-11T00:00:00 | end=2025-11-15T00:00:00
2025-11-14 11:06:05,446 - INFO - files have been merged to data_merged/merged_messages.csv
2025-11-14 11:06:05,446 - INFO - Executing step2_get_processed_data...
2025-11-14 11:06:05,497 - INFO - Deleted rows where meter_serial is NULL
2025-11-14 11:06:05,497 - INFO - remain 10670 rows
2025-11-14 11:06:05,497 - INFO - Deleting duplicate data for the same water meter with a time interval less than 14 minutes, and only retaining the first one
2025-11-14 11:06:08,225 - INFO - Deleted duplicate rows with a time difference less than 14 minutes (only the first one was kept), 1042 rows deleted
2025-11-14 11:06:08,225 - INFO - remain 9628 rows
2025-11-14 11:06:08,226 - INFO - Updating timestamp to the nearest 15 minutes
2025-11-14 11:06:08,244 - INFO - Updated all timestamps to the latest 15 minutes
2025-11-14 11:06:08,244 - INFO - Deleting abnormal readings under the same water meter
2025-11-14 11:06:08,776 - INFO - Deleted rows with abnormal reading, a total of 0 rows deleted
2025-11-14 11:06:08,776 - INFO - remain 9628 rows
2025-11-14 11:06:08,823 - INFO - The data is processed and saved to data_merged/processed_messages.csv
2025-11-14 11:06:08,823 - INFO - Executing step3_get_NMI12_ori...
2025-11-14 11:06:08,823 - INFO - NMI12 startTime:2025-11-12 00:00:00, endTime:2025-11-14 23:59:59
2025-11-14 11:06:09,889 - INFO - Saved the file data_merged/NMI12/NEM12#2025111200001#X4MDP#Evergy.csv
2025-11-14 11:06:09,912 - INFO - Saved the file data_merged/NMI12/NEM12#2025111300002#X4MDP#Evergy.csv
2025-11-14 11:06:09,913 - INFO - Generated!
2025-11-14 11:06:09,913 - INFO - Executing step4_get_all300_andTiggerDate...
2025-11-14 11:06:09,916 - INFO - Sorted data saved to data_merged/output_meter_data_sorted.csv
2025-11-14 11:06:09,916 - INFO - Backtracked data saved to data_merged/output_meter_data_backtracked_sorted.csv
2025-11-14 11:06:09,916 - INFO - Executing step5_multiple300_clear610...
2025-11-14 11:06:09,918 - INFO - Modified file NEM12#2025111200001#X4MDP#Evergy.csv
2025-11-14 11:06:09,918 - INFO - Modified file NEM12#2025111300002#X4MDP#Evergy.csv
2025-11-14 11:06:09,918 - INFO - Modified file NEM12#2025111100001#X4MDP#Evergy.csv
2025-11-14 11:06:09,919 - INFO - Modified file NEM12#2025111200002#X4MDP#Evergy.csv
2025-11-14 11:06:09,919 - INFO - Executing step6_clear610and710...
2025-11-14 11:06:09,919 - INFO - file: NEM12#2025111100001#X4MDP#Evergy.csv
2025-11-14 11:06:09,919 - INFO - dict: {}
2025-11-14 11:06:09,919 - INFO - nums of meters: 0

2025-11-14 11:06:09,919 - INFO - file: NEM12#2025111200001#X4MDP#Evergy.csv
2025-11-14 11:06:09,919 - INFO - dict: {}
2025-11-14 11:06:09,919 - INFO - nums of meters: 0

2025-11-14 11:06:09,919 - INFO - file: NEM12#2025111200002#X4MDP#Evergy.csv
2025-11-14 11:06:09,919 - INFO - dict: {}
2025-11-14 11:06:09,919 - INFO - nums of meters: 0

2025-11-14 11:06:09,919 - INFO - file: NEM12#2025111300002#X4MDP#Evergy.csv
2025-11-14 11:06:09,919 - INFO - dict: {}
2025-11-14 11:06:09,919 - INFO - nums of meters: 0

2025-11-14 11:06:09,920 - INFO - Step 6 is completed, the results have been saved to data_merged/meter_dict.csv and data_merged/modification_records.csv
2025-11-14 11:06:09,920 - INFO - Executing step7_SendEmail...
2025-11-14 11:06:09,920 - INFO - Start scanning the directory: /Users/jdk/github_repos/meter-reading-system-AllinOne/apps/backend/NEM12_generater/data_merged/NMI12_modified

2025-11-14 11:06:09,920 - ERROR - Error in step7_SendEmail: [Errno 2] No such file or directory: '../data_merged/NMI12_modified'
2025-11-14 11:06:09,920 - INFO - Master workflow execution completed.
2025-11-14 11:06:09,934 - INFO - Next run scheduled at 2025-11-15 11:06:00. Sleeping for 86390.065997 seconds.
2025-11-14 11:06:19,717 - INFO - Terminating the workflow gracefully...
2025-11-14 11:07:13,226 - INFO - Next run scheduled at 2025-11-14 11:08:00. Sleeping for 46.773473 seconds.
2025-11-14 11:08:00,014 - INFO - Starting execution of master workflow...
2025-11-14 11:08:00,017 - INFO - Executing step7_SendEmail...
2025-11-14 11:08:00,023 - INFO - Start scanning the directory: /Users/jdk/github_repos/meter-reading-system-AllinOne/apps/backend/NEM12_generater/data_merged/NMI12_modified

2025-11-14 11:10:58,388 - INFO - Terminating the workflow gracefully...
2025-11-14 11:10:58,946 - INFO - Next run scheduled at 2025-11-14 11:11:00. Sleeping for 1.053278 seconds.
2025-11-14 11:11:00,011 - INFO - Starting execution of master workflow...
2025-11-14 11:11:00,011 - INFO - Executing step7_SendEmail...
2025-11-14 11:11:00,020 - INFO - Start scanning the directory: /Users/jdk/github_repos/meter-reading-system-AllinOne/apps/backend/NEM12_generater/usthub_botany_mascot001_Daily/data_merged/NMI12_modified

2025-11-14 11:11:00,029 - INFO - ==============================================
2025-11-14 11:11:00,029 - INFO - 
Scan ended:
2025-11-14 11:11:00,029 - INFO - A total of 472 rows were scanned
2025-11-14 11:11:00,030 - INFO - A total of 0 rows contained negative numbers
2025-11-14 11:11:00,030 - INFO - A total of 0 rows contained an F at row 300
2025-11-14 11:11:00,030 - INFO - A total of 0 rows contained an F at row 400
2025-11-14 11:11:00,030 - INFO - A total of 0 rows contained the second-to-last value of 610 > 1
2025-11-14 11:11:00,030 - INFO - 

2025-11-14 11:11:00,030 - INFO - =============================================
2025-11-14 11:11:00,030 - INFO - 
[610 Over-Limit Summary] No records found.
2025-11-14 11:11:01,039 - INFO - Email sent to ['winston@jdktech.com.au', 'winston.hu2143@hotmail.com'] with NEM12#2025111300002#X4MDP#Evergy.csv
2025-11-14 11:11:01,039 - INFO - Master workflow execution completed.
2025-11-14 11:11:01,065 - INFO - Next run scheduled at 2025-11-15 11:11:00. Sleeping for 86398.934114 seconds.
2025-11-14 11:11:07,822 - INFO - Terminating the workflow gracefully...
